{
  "opentheme": "1.0",
  "id": "uid.abcdefghijklmnopqrstuv2345",
  "version": "1.0.0",
  "name": "High Contrast Ready",
  "provenance": {
    "origin": "developer-authored"
  },
  "compatibility": {
    "catalog": "1.0"
  },
  "colorSchemes": {
    "supported": [
      "light"
    ],
    "default": "light"
  },
  "seeds": {
    "light": {
      "background": {
        "colorSpace": "srgb",
        "components": [
          0.98,
          0.97,
          0.95
        ]
      },
      "foreground": {
        "colorSpace": "srgb",
        "components": [
          0.12,
          0.12,
          0.14
        ]
      },
      "accent": {
        "colorSpace": "oklch",
        "components": [
          0.55,
          0.15,
          250
        ]
      }
    },
    "fontFamily": [
      "Source Sans 3",
      "system-ui",
      "sans-serif"
    ]
  },
  "tokens": {
    "color": {
      "text": {
        "primary": {
          "$type": "color",
          "$value": {
            "colorSpace": "srgb",
            "components": [
              0.2,
              0.2,
              0.22
            ]
          }
        }
      }
    }
  },
  "contexts": [
    {
      "when": {
        "contrast": "high"
      },
      "tokens": {
        "color": {
          "text": {
            "primary": {
              "$value": {
                "colorSpace": "srgb",
                "components": [
                  0,
                  0,
                  0
                ]
              }
            }
          }
        }
      }
    }
  ]
}
